{
  "milestone_id": "001_nema17_belt_linear_actuator",
  "status": "draft",
  "checks": [
    {
      "check_id": "CHK-001",
      "name": "Seed required files exist",
      "result": "pass",
      "evidence": "Generated by Zen CAD kit scaffold and validated by scripts/validate_milestone.py.",
      "limitations": []
    },
    {
      "check_id": "CHK-002",
      "name": "Engineering ratings verified",
      "result": "blocked",
      "evidence": "No real datasheets attached in seed.",
      "limitations": [
        "seed is not final engineering evidence"
      ]
    },
    {
      "check_id": "CHK-003",
      "name": "CAD kernel checks",
      "result": "not_run",
      "evidence": "No final CAD generated in seed.",
      "limitations": [
        "future milestone revision must run CAD load/export checks"
      ]
    }
  ],
  "summary": "Reference seed validates workflow structure only; it does not certify actuator design."
}
