{
  "milestone_id": "001_nema17_belt_linear_actuator",
  "status": "draft",
  "checks": [
    {
      "check_id": "CHK-001",
      "name": "Seed required files exist",
      "result": "pass",
      "evidence_type": "structure",
      "evidence": "Generated by Zen CAD kit scaffold and validated by scripts/validate_milestone.py.",
      "command": {
        "argv": [
          "python3",
          "scripts/validate_milestone.py",
          "milestones/001_nema17_belt_linear_actuator"
        ],
        "cwd": ".",
        "exit_code": 0
      },
      "artifacts": [],
      "limitations": []
    },
    {
      "check_id": "CHK-002",
      "name": "Engineering ratings verified",
      "result": "blocked",
      "evidence_type": "other",
      "evidence": "No real datasheets attached in seed.",
      "command": {
        "argv": [],
        "cwd": "",
        "exit_code": 1
      },
      "artifacts": [],
      "limitations": [
        "seed is not final engineering evidence"
      ]
    },
    {
      "check_id": "CHK-003",
      "name": "CAD kernel checks",
      "result": "not_run",
      "evidence_type": "step_load",
      "evidence": "No final CAD generated in seed.",
      "command": {
        "argv": [],
        "cwd": "",
        "exit_code": 1
      },
      "artifacts": [],
      "limitations": [
        "future milestone revision must run CAD load/export checks"
      ]
    }
  ],
  "summary": "Reference seed validates workflow structure only; it does not certify actuator design."
}
